{"authority_effect":"NONE","coordinator_session_id":"coordinator:reading-set-k7","id":"reading-5a7348b47ad609abbc5871d6","packet_kind":"AGENT_REVIEW_PACKET","schema_version":1,"subjects":[{"binding":{"path":"artifacts/agent_research/reading/set-k7-v1/public/read-bc2de607ba9a89417a59f2a0.txt","sha256":"e483afa1ab916836e8b52a93a89b05ff064ed5bc8011c45efa04c736aeb7afe6"},"id":"read-bc2de607ba9a89417a59f2a0","scope":"CANDIDATE"},{"binding":{"path":"artifacts/agent_research/reading/set-k7-v1/public/read-a50044cfb9d00954ccc935b7.txt","sha256":"781888bb0226716fd43155c276b5b5e2d1f0743bd6d3444741d159d8d7171a75"},"id":"read-a50044cfb9d00954ccc935b7","scope":"CANDIDATE"},{"binding":{"path":"artifacts/agent_research/reading/set-k7-v1/public/read-7764f395f666c95e1b25ae3a.txt","sha256":"a64f5a96de991b0a6df767951fd8cca0d1a1389ee4aee4f686563ec548925274"},"id":"read-7764f395f666c95e1b25ae3a","scope":"CANDIDATE"}],"usage":"RESEARCH_ONLY"}
